{
  "spec_version": "0.1",
  "name": "simple_chair",
  "views": {
    "front": {
      "path": "references/front.png",
      "roles": [
        "carve",
        "color",
        "validate"
      ],
      "background": {
        "mode": "alpha"
      }
    },
    "side": {
      "path": "references/side.png",
      "camera_axis": "-X",
      "roles": [
        "carve",
        "color",
        "validate"
      ],
      "background": {
        "mode": "alpha"
      }
    },
    "top": {
      "path": "references/top.png",
      "roles": [
        "validate"
      ],
      "background": {
        "mode": "alpha"
      }
    },
    "back": {
      "path": "references/back.png",
      "roles": [
        "color",
        "validate"
      ],
      "background": {
        "mode": "alpha"
      }
    }
  },
  "known_dimensions": {
    "width": 0.45,
    "depth": 0.45,
    "height": 0.85
  },
  "symmetry": {
    "x": true,
    "y": false,
    "z": false
  },
  "reference_quality": {
    "orthographic": true,
    "synthetic": true,
    "notes": "synthetic references (transparent background) generated by run_pipeline.py --make-synthetic-references"
  }
}
