{
  "spec_version": "0.1",
  "name": "sd_astronaut",
  "views": {
    "front": {
      "path": "references/front.png",
      "camera_axis": "-Y",
      "roles": [
        "carve",
        "color",
        "validate"
      ],
      "background": {
        "mode": "auto",
        "tolerance": 0.12,
        "remove_enclosed": true
      },
      "confidence": "observed",
      "calibration": {
        "mode": "sheet"
      }
    },
    "back": {
      "path": "references/back.png",
      "camera_axis": "+Y",
      "roles": [
        "color",
        "validate"
      ],
      "background": {
        "mode": "auto",
        "tolerance": 0.12,
        "remove_enclosed": true
      },
      "confidence": "observed",
      "calibration": {
        "mode": "sheet"
      }
    },
    "side": {
      "path": "references/side.png",
      "camera_axis": "-X",
      "roles": [
        "carve",
        "color",
        "validate"
      ],
      "background": {
        "mode": "auto",
        "tolerance": 0.12,
        "remove_enclosed": true
      },
      "confidence": "observed",
      "calibration": {
        "mode": "sheet"
      }
    }
  },
  "known_dimensions": {
    "width": null,
    "depth": null,
    "height": 0.6
  },
  "symmetry": {
    "x": true,
    "y": false,
    "z": false
  },
  "reference_quality": {
    "orthographic": true,
    "ai_generated": true,
    "notes": "drafted by prepare_references.py; chroma backdrop: front green, back green, side green"
  }
}
