{
  "spec_version": "0.1",
  "name": "simple_table",
  "views": {
    "front": {"path": "references/front.png", "roles": ["carve", "color", "validate"], "notes": "synthetic, rendered from scene_spec.json"},
    "side": {"path": "references/side.png", "camera_axis": "-X", "roles": ["carve", "color", "validate"]},
    "top": {"path": "references/top.png", "roles": ["validate"]}
  },
  "known_dimensions": {"width": 1.2, "depth": 0.6, "height": 0.72},
  "symmetry": {"x": true, "y": true, "z": false},
  "reference_quality": {"orthographic": true, "synthetic": true, "notes": "synthetic references generated by run_pipeline.py --make-synthetic-references"}
}
