{
  "spec_version": "0.1",
  "name": "sd_fox",
  "views": {
    "front": {
      "path": "references/front.png",
      "camera_axis": "-Y",
      "roles": [
        "carve",
        "color",
        "validate"
      ],
      "background": {
        "mode": "auto",
        "tolerance": 0.12
      },
      "confidence": "observed"
    },
    "side": {
      "path": "references/side.png",
      "camera_axis": "-X",
      "roles": [
        "carve",
        "color",
        "validate"
      ],
      "background": {
        "mode": "auto",
        "tolerance": 0.12
      },
      "confidence": "observed",
      "notes": "face points image-right -> -X"
    },
    "back": {
      "path": "references/back.png",
      "camera_axis": "+Y",
      "roles": [
        "color",
        "validate"
      ],
      "background": {
        "mode": "auto",
        "tolerance": 0.12
      },
      "confidence": "observed"
    }
  },
  "known_dimensions": {
    "width": null,
    "depth": null,
    "height": 0.6
  },
  "symmetry": {
    "x": false,
    "y": false,
    "z": false
  },
  "reference_quality": {
    "orthographic": false,
    "notes": "AI-generated turnaround, green chroma"
  }
}